{
  "schemaVersion": "G0-PROJECT-STATE-CONTRACT-v1",
  "ledgerId": "IYPT13-PREEXPERIMENT-STATE-20260901-PR2A-PREOBSERVATION-BLOCKED",
  "project": "IYPT-2027-P13-VORTEX-PENDULUM",
  "baselineCommit": "571c128a3d4fddb6e55e8bffa55d69b8fab27453",
  "generatedAt": "2026-09-01T19:18:12+09:00",
  "conclusionCeiling": "EXPERIMENT_PREPARATION_ONLY",
  "workPackages": [
    {
      "id": "WP-R0",
      "title": "中断串行尝试的运行终止事实",
      "owner": "runtime",
      "priority": "P0",
      "status": "INCONCLUSIVE",
      "predecessors": [],
      "evidence": [
        {
          "kind": "runtime-observation",
          "path": "90_候选工作区/current/G0_全项目完成度与实验前暂停治理/evidence/r0-host-shutdown-20260901.json",
          "sha256": "889eafc3a340f60d5d5743b64df086ab6b603ed9173465a54b62ef42542fb85c",
          "claim": "Host shutdown ended the intended serial reference before canonical artifact creation; this is governance evidence only."
        }
      ],
      "terminationCode": "INCONCLUSIVE-R0-HOST-SHUTDOWN-NO-CANONICAL-ARTIFACT",
      "nextGate": "WP-R1I"
    },
    {
      "id": "WP-R1",
      "title": "正常串行参考产物封存分支（不可达）",
      "owner": "Codex",
      "priority": "P0",
      "status": "INCONCLUSIVE",
      "predecessors": [
        "WP-R0"
      ],
      "evidence": [
        {
          "kind": "governance",
          "path": "90_候选工作区/current/G0_全项目完成度与实验前暂停治理/04_PR1_串行参考关机中断与硬件路线接续裁决.md",
          "sha256": "65f964ea9973c688b1d16b517808fb45efaab75fb74f16e734977cd5c2203aee",
          "claim": "PR-1 supersedes the unreachable normal serial artifact-seal branch with R1I."
        }
      ],
      "terminationCode": "SUPERSEDED-R1-NORMAL-ARTIFACT-SEAL-BY-R1I-AFTER-R0-INTERRUPTION",
      "nextGate": "WP-R1I"
    },
    {
      "id": "WP-R1I",
      "title": "中断串行尝试证据封存与旧工作区退役",
      "owner": "Codex",
      "priority": "P0",
      "status": "PASS",
      "predecessors": [
        "WP-R0"
      ],
      "evidence": [
        {
          "kind": "runtime-observation",
          "path": "90_候选工作区/current/G0_全项目完成度与实验前暂停治理/evidence/r1i-interrupted-serial-attempt-seal-20260901.json",
          "sha256": "d459f1fa42e1f1bfdec93ad4ee37fdf25d230c6d8fdc383ed83ac47e9490f79e",
          "claim": "R1I seals the interrupted attempt without scientific payload, partial credit, or restart authority."
        }
      ],
      "terminationCode": "PASS-R1I-INTERRUPTED-SERIAL-ATTEMPT-EVIDENCE-SEALED",
      "nextGate": "WP-G1 + WP-HW1"
    },
    {
      "id": "WP-G1",
      "title": "全仓状态总账、CI 和检查范围治理",
      "owner": "Codex",
      "priority": "P0",
      "status": "PASS",
      "predecessors": [],
      "evidence": [
        {
          "kind": "governance",
          "path": "90_候选工作区/current/G0_全项目完成度与实验前暂停治理/01_全项目完成度审查与实验前可暂停主规划裁决.md",
          "sha256": "5d2fd4ffbc57bbdd9e056462e085f5f673efe5daed269e024cf82f01ad9f50e7",
          "claim": "Whole-project route, completion boundaries, and pause-ready definition are frozen."
        }
      ],
      "terminationCode": "PASS-G1-RESULT-BEFORE-FOUNDATION",
      "nextGate": "WP-HW2R"
    },
    {
      "id": "WP-HW1",
      "title": "H1 v2 机器合同、测试和无结果架构",
      "owner": "Codex",
      "priority": "P0",
      "status": "PASS",
      "predecessors": [
        "WP-G1",
        "WP-R1I"
      ],
      "evidence": [
        {
          "kind": "contract",
          "path": "90_候选工作区/current/H1_硬件利用与执行架构/contracts/h1-machine-contract.v2.json",
          "sha256": "387c644be55f6f9c479ccc84ae8ed68668b4ecafab73e2e3608a1a5a3805e311",
          "claim": "H1 v2 preserves result-blind, safety, provenance, and dual-run requirements after PR-1."
        }
      ],
      "terminationCode": "PASS-HW1-V2-RESULT-BEFORE-FOUNDATION",
      "nextGate": "WP-HW2R"
    },
    {
      "id": "WP-E1",
      "title": "实验准备、数据和辨识预注册包",
      "owner": "Codex",
      "priority": "P0",
      "status": "PASS",
      "predecessors": [
        "WP-G1"
      ],
      "evidence": [
        {
          "kind": "contract",
          "path": "90_候选工作区/current/E1_实验准备与辨识协议/contracts/e1-contract.v1.json",
          "sha256": "f71cc5a2450de9846eb5dd5b454a0012641a7c9b0543eba898b54cfc44b28dc3",
          "claim": "Synthetic experiment-preparation contract is frozen; no experiment has been performed."
        }
      ],
      "terminationCode": "PASS-E1-EXPERIMENT-PREPARATION-CANDIDATE-ONLY",
      "nextGate": "WP-I1"
    },
    {
      "id": "WP-F1",
      "title": "正式前向数值资格候选包",
      "owner": "Codex",
      "priority": "P1",
      "status": "PASS",
      "predecessors": [
        "WP-G1"
      ],
      "evidence": [
        {
          "kind": "contract",
          "path": "90_候选工作区/current/F1_前向数值资格与闭合包接口/contracts/f1-contract.v1.json",
          "sha256": "ed8fefaeda74621d00aef2e7d24d6258a90358b2babf55ecfdfcadf46aaaabce",
          "claim": "Synthetic forward numerical qualification contract is frozen; formal bridge remains pending."
        }
      ],
      "terminationCode": "PASS-F1-SYNTHETIC-NUMERICAL-QUALIFICATION-ONLY",
      "nextGate": "WP-I1"
    },
    {
      "id": "WP-S1",
      "title": "结构分析实验前最小工具闭合",
      "owner": "Codex",
      "priority": "P1",
      "status": "PASS",
      "predecessors": [
        "WP-G1"
      ],
      "evidence": [
        {
          "kind": "contract",
          "path": "90_候选工作区/current/S1_结构分析实验前最小工具/contracts/s1-contract.v1.json",
          "sha256": "e2b22e590d01751bf097316317b46689f152ac26a35475345c5c936cc0d4d88a",
          "claim": "Synthetic structural-tool contract is frozen; apparatus bifurcation evidence remains absent."
        }
      ],
      "terminationCode": "PASS-S1-EXPERIMENT-PREPARATION-STRUCTURAL-TOOLS",
      "nextGate": "WP-I1"
    },
    {
      "id": "WP-HW2",
      "title": "硬件资格父工作包",
      "owner": "Codex",
      "priority": "P0",
      "status": "IN_PROGRESS",
      "predecessors": [
        "WP-G1",
        "WP-HW1",
        "WP-R1I"
      ],
      "evidence": [
        {
          "kind": "implementation-test",
          "path": "90_候选工作区/current/H1_硬件利用与执行架构/evidence/hw2-qualification-20260901-attempt-02.json",
          "sha256": "bfcdcabb91ac7f12d10afb7efaa46460ddcc8d59f15b95049ff340a85be835e6",
          "claim": "HW2 v1 is retained only as synthetic harness coverage, safety, and determinism evidence."
        }
      ],
      "terminationCode": null,
      "nextGate": "WP-HW2R + WP-H2X + conditional WP-H2N + PR-2B"
    },
    {
      "id": "WP-HW2R",
      "title": "代表性硬件测量与最终候选选择",
      "owner": "Codex",
      "priority": "P0",
      "status": "IN_PROGRESS",
      "predecessors": [
        "WP-G1",
        "WP-HW1",
        "WP-R1I"
      ],
      "evidence": [
        {
          "kind": "governance",
          "path": "90_候选工作区/current/G0_全项目完成度与实验前暂停治理/08_PR2A_fa73bda观测前实现复核与全项目终点规划裁决.md",
          "sha256": "acff1a5ccb41b909ad7c6c34e2c21600b774bbaf4ca3df1b6ec2d31e32cabaaf",
          "claim": "PR-2A rejects formal observation readiness and defines the complete machine-gated route."
        },
        {
          "kind": "governance",
          "path": "90_候选工作区/current/H1_硬件利用与执行架构/contracts/hw2r-pre-observation-readiness.v1.json",
          "sha256": "73dc85806aafcc748d016e85ec90b65738ec66fc707741cf5505231566416699",
          "claim": "Machine gate blocks formal observation until every open finding has committed closure evidence."
        }
      ],
      "terminationCode": null,
      "nextGate": "Close seven findings, then formal HW2R"
    },
    {
      "id": "WP-H2X",
      "title": "冻结科学源精确执行等价",
      "owner": "Codex",
      "priority": "P0",
      "status": "WAITING_PREDECESSOR",
      "predecessors": [
        "WP-HW2R"
      ],
      "evidence": [],
      "terminationCode": null,
      "nextGate": "PASS-H2X or fail-closed NO-GO"
    },
    {
      "id": "WP-H2N",
      "title": "非逐字节后端阶段零与条件完整数值资格",
      "owner": "Codex",
      "priority": "P0",
      "status": "DEFERRED_CONDITIONAL",
      "predecessors": [
        "WP-HW2R"
      ],
      "evidence": [],
      "terminationCode": "DEFERRED-H2N-PENDING-REPRESENTATIVE-GAIN-TRIGGER",
      "nextGate": "Stage-0; continue fully only when representative gain exceeds 10 percent"
    },
    {
      "id": "WP-H3P",
      "title": "H3 结果前分片、恢复、产物和双环境准备",
      "owner": "Codex",
      "priority": "P0",
      "status": "WAITING_PREDECESSOR",
      "predecessors": [
        "WP-HW2R",
        "WP-H2X"
      ],
      "evidence": [],
      "terminationCode": null,
      "nextGate": "PR-2B"
    },
    {
      "id": "WP-HW3",
      "title": "HW1-primary 与 HW1-repeat 两次新鲜硬件全量运行",
      "owner": "runtime",
      "priority": "P0",
      "status": "WAITING_PREDECESSOR",
      "predecessors": [
        "WP-HW2",
        "WP-H3P"
      ],
      "evidence": [],
      "terminationCode": null,
      "nextGate": "PR-2B explicit unlock"
    },
    {
      "id": "WP-A8T",
      "title": "A8R 科学终局和路线处置",
      "owner": "Pro",
      "priority": "P0",
      "status": "WAITING_PREDECESSOR",
      "predecessors": [
        "WP-HW3"
      ],
      "evidence": [],
      "terminationCode": null,
      "nextGate": "PR-3"
    },
    {
      "id": "WP-I1",
      "title": "正式软件诚实对齐与候选集成",
      "owner": "Codex",
      "priority": "P1",
      "status": "WAITING_PREDECESSOR",
      "predecessors": [
        "WP-E1",
        "WP-F1",
        "WP-S1",
        "WP-A8T"
      ],
      "evidence": [],
      "terminationCode": null,
      "nextGate": "Formal alignment after PR-3"
    },
    {
      "id": "WP-PHY",
      "title": "新物理或高保真路线",
      "owner": "Pro",
      "priority": "P3",
      "status": "DEFERRED_CONDITIONAL",
      "predecessors": [
        "WP-A8T"
      ],
      "evidence": [],
      "terminationCode": "DEFERRED-PHY-AWAITING-PR3-OR-EXPERIMENT-TRIGGER",
      "nextGate": "PR-3 or experiment trigger"
    },
    {
      "id": "WP-DOC",
      "title": "活动文档、证据索引和交接闭合",
      "owner": "Codex",
      "priority": "P1",
      "status": "IN_PROGRESS",
      "predecessors": [
        "WP-G1"
      ],
      "evidence": [],